{
  "$schema": "../../contracts/module-manifest/module-manifest.schema.json",
  "key": "crm",
  "name": "SuperCampus CRM",
  "version": "0.1.0",
  "backendCrate": "supercampus-crm",
  "permissions": [
    "crm.leads.read",
    "crm.leads.create",
    "crm.leads.import",
    "crm.leads.update",
    "crm.leads.delete",
    "crm.leads.assign",
    "crm.leads.claim",
    "crm.leads.stage.move",
    "crm.leads.hold",
    "crm.leads.hold.release",
    "crm.leads.archive",
    "crm.leads.unarchive",
    "crm.forms.read",
    "crm.forms.manage",
    "crm.forms.publish",
    "crm.forms.submit",
    "crm.forms.submissions.read",
    "crm.communications.send",
    "crm.templates.read",
    "crm.templates.manage",
    "crm.assignment.read",
    "crm.assignment.manage",
    "crm.configuration.read",
    "crm.configuration.manage",
    "crm.dashboard.read",
    "crm.erp.handoff",
    "crm.reports.read",
    "crm.campaigns.read",
    "crm.campaigns.manage"
  ],
  "capabilities": [
    "lead-capture",
    "weighted-assignment",
    "pre-admission-pipeline",
    "kanban-dashboard",
    "dynamic-forms",
    "communications",
    "archive-and-hold",
    "erp-handoff",
    "role-scoped-access",
    "tenant-workflow-configuration",
    "transactional-outbox",
    "permission-audit"
  ]
}
